{
  "id": "img-2024-ct-renal",
  "patientId": "person-001",
  "studyInstanceUid": "1.2.840.113619.2.55.3.604688435.7890.1700000000.2",
  "modality": { "system": "http://dicom.nema.org/resources/ontology/DCM", "code": "CT", "display": "Computed Tomography" },
  "bodySite": { "system": "http://snomed.info/sct", "code": "64033007", "display": "Kidney structure" },
  "reportedAt": "2024-11-12T16:10:00Z",
  "performer": { "id": "rad-015", "name": "Dr. Chen", "role": "Radiologist" },
  "findings": [
    "双肾大小形态正常，未见结石或肿块。",
    "肾周脂肪间隙清晰。"
  ],
  "impression": "肾脏 CT 未见异常。",
  "radiationDose": { "ctdiVol_mGy": 4.5, "dlp_mGy_cm": 180.0 }
}
